<?xml version="1.0"?>
<!--/*
 * @package     BlueAcorn\ProductIntegration
 * @version     1.0.0
 * @author      Sam Tay @ Blue Acorn, Inc. <code@blueacorn.com>
 * @copyright   Copyright Â© 2016 Blue Acorn, Inc.
 */-->
<config xmlns:xsi="http://www.w3.org/2001/XMLSchema-instance" xsi:noNamespaceSchemaLocation="urn:magento:module:BlueAcorn_AmqpBase:etc/consumer.xsd">
    <consumer name="productCreatedListener">
        <daemon_count>2</daemon_count>
        <email_subject>Product Creation Error</email_subject>
    </consumer>
    <consumer name="productCreatedBatchListener">
        <daemon_count>0</daemon_count>
        <email_subject>Product Create Batch Error</email_subject>
    </consumer>
    <consumer name="productUpdatedListener">
        <daemon_count>2</daemon_count>
        <email_subject>Product Update Error</email_subject>
    </consumer>
    <consumer name="productUpdatedBatchListener">
        <daemon_count>0</daemon_count>
        <email_subject>Product Update Batch Error</email_subject>
    </consumer>
</config>
